{
  "$schema": "https://json-schema.org/draft/2020-12/schema",
  "$id": "urn:oasis:names:specification:ubl:schema:json:SelfBilledCreditNote-2",
  "description": "A credit note created by the debtor in a self billing arrangement with a creditor.",
  "type": "object",
  "properties": {
    "UBLEntity": {
      "const": "urn:oasis:names:specification:ubl:schema:json:SelfBilledCreditNote-2",
      "description": "Identifies the JSON schema governing this instance."
    },
    "UBLExtensions": {
      "$ref": "urn:oasis:names:specification:ubl:schema:json:CommonExtensionComponents-2#/$defs/UBLExtensionsType"
    },
    "Signature": {
      "oneOf": [
        {
          "$ref": "urn:oasis:names:specification:ubl:schema:json:CommonAggregateComponents-2#/$defs/SignatureType"
        },
        {
          "type": "array",
          "items": {
            "$ref": "urn:oasis:names:specification:ubl:schema:json:CommonAggregateComponents-2#/$defs/SignatureType"
          }
        }
      ]
    },
    "UBLVersionID": {
      "$ref": "urn:oasis:names:specification:ubl:schema:json:CommonBasicComponents-2#/$defs/UBLVersionID"
    },
    "CustomizationID": {
      "$ref": "urn:oasis:names:specification:ubl:schema:json:CommonBasicComponents-2#/$defs/CustomizationID"
    },
    "ProfileID": {
      "$ref": "urn:oasis:names:specification:ubl:schema:json:CommonBasicComponents-2#/$defs/ProfileID"
    },
    "ProfileExecutionID": {
      "$ref": "urn:oasis:names:specification:ubl:schema:json:CommonBasicComponents-2#/$defs/ProfileExecutionID"
    },
    "ID": {
      "$ref": "urn:oasis:names:specification:ubl:schema:json:CommonBasicComponents-2#/$defs/ID"
    },
    "UUID": {
      "$ref": "urn:oasis:names:specification:ubl:schema:json:CommonBasicComponents-2#/$defs/UUID"
    },
    "IssueDate": {
      "$ref": "urn:oasis:names:specification:ubl:schema:json:CommonBasicComponents-2#/$defs/IssueDate"
    },
    "IssueTime": {
      "$ref": "urn:oasis:names:specification:ubl:schema:json:CommonBasicComponents-2#/$defs/IssueTime"
    },
    "DueDate": {
      "$ref": "urn:oasis:names:specification:ubl:schema:json:CommonBasicComponents-2#/$defs/DueDate"
    },
    "TaxPointDate": {
      "$ref": "urn:oasis:names:specification:ubl:schema:json:CommonBasicComponents-2#/$defs/TaxPointDate"
    },
    "CreditNoteTypeCode": {
      "$ref": "urn:oasis:names:specification:ubl:schema:json:CommonBasicComponents-2#/$defs/CreditNoteTypeCode"
    },
    "Note": {
      "oneOf": [
        {
          "$ref": "urn:oasis:names:specification:ubl:schema:json:CommonBasicComponents-2#/$defs/Note"
        },
        {
          "type": "array",
          "items": {
            "$ref": "urn:oasis:names:specification:ubl:schema:json:CommonBasicComponents-2#/$defs/Note"
          }
        }
      ]
    },
    "DocumentCurrencyCode": {
      "$ref": "urn:oasis:names:specification:ubl:schema:json:CommonBasicComponents-2#/$defs/DocumentCurrencyCode"
    },
    "TaxCurrencyCode": {
      "$ref": "urn:oasis:names:specification:ubl:schema:json:CommonBasicComponents-2#/$defs/TaxCurrencyCode"
    },
    "PricingCurrencyCode": {
      "$ref": "urn:oasis:names:specification:ubl:schema:json:CommonBasicComponents-2#/$defs/PricingCurrencyCode"
    },
    "PaymentCurrencyCode": {
      "$ref": "urn:oasis:names:specification:ubl:schema:json:CommonBasicComponents-2#/$defs/PaymentCurrencyCode"
    },
    "PaymentAlternativeCurrencyCode": {
      "$ref": "urn:oasis:names:specification:ubl:schema:json:CommonBasicComponents-2#/$defs/PaymentAlternativeCurrencyCode"
    },
    "AccountingCostCode": {
      "$ref": "urn:oasis:names:specification:ubl:schema:json:CommonBasicComponents-2#/$defs/AccountingCostCode"
    },
    "AccountingCost": {
      "$ref": "urn:oasis:names:specification:ubl:schema:json:CommonBasicComponents-2#/$defs/AccountingCost"
    },
    "LineCountNumeric": {
      "$ref": "urn:oasis:names:specification:ubl:schema:json:CommonBasicComponents-2#/$defs/LineCountNumeric"
    },
    "DefaultLanguageCode": {
      "$ref": "urn:oasis:names:specification:ubl:schema:json:CommonBasicComponents-2#/$defs/DefaultLanguageCode"
    },
    "InvoicePeriod": {
      "oneOf": [
        {
          "$ref": "urn:oasis:names:specification:ubl:schema:json:CommonAggregateComponents-2#/$defs/PeriodType"
        },
        {
          "type": "array",
          "items": {
            "$ref": "urn:oasis:names:specification:ubl:schema:json:CommonAggregateComponents-2#/$defs/PeriodType"
          }
        }
      ]
    },
    "DiscrepancyResponse": {
      "oneOf": [
        {
          "$ref": "urn:oasis:names:specification:ubl:schema:json:CommonAggregateComponents-2#/$defs/ResponseType"
        },
        {
          "type": "array",
          "items": {
            "$ref": "urn:oasis:names:specification:ubl:schema:json:CommonAggregateComponents-2#/$defs/ResponseType"
          }
        }
      ]
    },
    "OrderReference": {
      "$ref": "urn:oasis:names:specification:ubl:schema:json:CommonAggregateComponents-2#/$defs/OrderReferenceType"
    },
    "BillingReference": {
      "oneOf": [
        {
          "$ref": "urn:oasis:names:specification:ubl:schema:json:CommonAggregateComponents-2#/$defs/BillingReferenceType"
        },
        {
          "type": "array",
          "items": {
            "$ref": "urn:oasis:names:specification:ubl:schema:json:CommonAggregateComponents-2#/$defs/BillingReferenceType"
          }
        }
      ]
    },
    "DespatchDocumentReference": {
      "oneOf": [
        {
          "$ref": "urn:oasis:names:specification:ubl:schema:json:CommonAggregateComponents-2#/$defs/DocumentReferenceType"
        },
        {
          "type": "array",
          "items": {
            "$ref": "urn:oasis:names:specification:ubl:schema:json:CommonAggregateComponents-2#/$defs/DocumentReferenceType"
          }
        }
      ]
    },
    "DeliveryNoteDocumentReference": {
      "oneOf": [
        {
          "$ref": "urn:oasis:names:specification:ubl:schema:json:CommonAggregateComponents-2#/$defs/DocumentReferenceType"
        },
        {
          "type": "array",
          "items": {
            "$ref": "urn:oasis:names:specification:ubl:schema:json:CommonAggregateComponents-2#/$defs/DocumentReferenceType"
          }
        }
      ]
    },
    "WorkReportDocumentReference": {
      "oneOf": [
        {
          "$ref": "urn:oasis:names:specification:ubl:schema:json:CommonAggregateComponents-2#/$defs/DocumentReferenceType"
        },
        {
          "type": "array",
          "items": {
            "$ref": "urn:oasis:names:specification:ubl:schema:json:CommonAggregateComponents-2#/$defs/DocumentReferenceType"
          }
        }
      ]
    },
    "ReceiptDocumentReference": {
      "oneOf": [
        {
          "$ref": "urn:oasis:names:specification:ubl:schema:json:CommonAggregateComponents-2#/$defs/DocumentReferenceType"
        },
        {
          "type": "array",
          "items": {
            "$ref": "urn:oasis:names:specification:ubl:schema:json:CommonAggregateComponents-2#/$defs/DocumentReferenceType"
          }
        }
      ]
    },
    "ContractDocumentReference": {
      "oneOf": [
        {
          "$ref": "urn:oasis:names:specification:ubl:schema:json:CommonAggregateComponents-2#/$defs/DocumentReferenceType"
        },
        {
          "type": "array",
          "items": {
            "$ref": "urn:oasis:names:specification:ubl:schema:json:CommonAggregateComponents-2#/$defs/DocumentReferenceType"
          }
        }
      ]
    },
    "StatementDocumentReference": {
      "oneOf": [
        {
          "$ref": "urn:oasis:names:specification:ubl:schema:json:CommonAggregateComponents-2#/$defs/DocumentReferenceType"
        },
        {
          "type": "array",
          "items": {
            "$ref": "urn:oasis:names:specification:ubl:schema:json:CommonAggregateComponents-2#/$defs/DocumentReferenceType"
          }
        }
      ]
    },
    "OriginatorDocumentReference": {
      "oneOf": [
        {
          "$ref": "urn:oasis:names:specification:ubl:schema:json:CommonAggregateComponents-2#/$defs/DocumentReferenceType"
        },
        {
          "type": "array",
          "items": {
            "$ref": "urn:oasis:names:specification:ubl:schema:json:CommonAggregateComponents-2#/$defs/DocumentReferenceType"
          }
        }
      ]
    },
    "AdditionalDocumentReference": {
      "oneOf": [
        {
          "$ref": "urn:oasis:names:specification:ubl:schema:json:CommonAggregateComponents-2#/$defs/DocumentReferenceType"
        },
        {
          "type": "array",
          "items": {
            "$ref": "urn:oasis:names:specification:ubl:schema:json:CommonAggregateComponents-2#/$defs/DocumentReferenceType"
          }
        }
      ]
    },
    "ProjectReference": {
      "oneOf": [
        {
          "$ref": "urn:oasis:names:specification:ubl:schema:json:CommonAggregateComponents-2#/$defs/ProjectReferenceType"
        },
        {
          "type": "array",
          "items": {
            "$ref": "urn:oasis:names:specification:ubl:schema:json:CommonAggregateComponents-2#/$defs/ProjectReferenceType"
          }
        }
      ]
    },
    "BuyerAssignedReference": {
      "oneOf": [
        {
          "$ref": "urn:oasis:names:specification:ubl:schema:json:CommonAggregateComponents-2#/$defs/BuyerAssignedReferenceType"
        },
        {
          "type": "array",
          "items": {
            "$ref": "urn:oasis:names:specification:ubl:schema:json:CommonAggregateComponents-2#/$defs/BuyerAssignedReferenceType"
          }
        }
      ]
    },
    "PurchaseReference": {
      "oneOf": [
        {
          "$ref": "urn:oasis:names:specification:ubl:schema:json:CommonAggregateComponents-2#/$defs/PurchaseReferenceType"
        },
        {
          "type": "array",
          "items": {
            "$ref": "urn:oasis:names:specification:ubl:schema:json:CommonAggregateComponents-2#/$defs/PurchaseReferenceType"
          }
        }
      ]
    },
    "Annotation": {
      "oneOf": [
        {
          "$ref": "urn:oasis:names:specification:ubl:schema:json:CommonAggregateComponents-2#/$defs/AnnotationType"
        },
        {
          "type": "array",
          "items": {
            "$ref": "urn:oasis:names:specification:ubl:schema:json:CommonAggregateComponents-2#/$defs/AnnotationType"
          }
        }
      ]
    },
    "AccountingCustomerParty": {
      "$ref": "urn:oasis:names:specification:ubl:schema:json:CommonAggregateComponents-2#/$defs/CustomerPartyType"
    },
    "AccountingSupplierParty": {
      "$ref": "urn:oasis:names:specification:ubl:schema:json:CommonAggregateComponents-2#/$defs/SupplierPartyType"
    },
    "PayeeParty": {
      "$ref": "urn:oasis:names:specification:ubl:schema:json:CommonAggregateComponents-2#/$defs/PartyType"
    },
    "BuyerCustomerParty": {
      "$ref": "urn:oasis:names:specification:ubl:schema:json:CommonAggregateComponents-2#/$defs/CustomerPartyType"
    },
    "SellerSupplierParty": {
      "$ref": "urn:oasis:names:specification:ubl:schema:json:CommonAggregateComponents-2#/$defs/SupplierPartyType"
    },
    "TaxRepresentativeParty": {
      "$ref": "urn:oasis:names:specification:ubl:schema:json:CommonAggregateComponents-2#/$defs/PartyType"
    },
    "Delivery": {
      "oneOf": [
        {
          "$ref": "urn:oasis:names:specification:ubl:schema:json:CommonAggregateComponents-2#/$defs/DeliveryType"
        },
        {
          "type": "array",
          "items": {
            "$ref": "urn:oasis:names:specification:ubl:schema:json:CommonAggregateComponents-2#/$defs/DeliveryType"
          }
        }
      ]
    },
    "DeliveryTerms": {
      "oneOf": [
        {
          "$ref": "urn:oasis:names:specification:ubl:schema:json:CommonAggregateComponents-2#/$defs/DeliveryTermsType"
        },
        {
          "type": "array",
          "items": {
            "$ref": "urn:oasis:names:specification:ubl:schema:json:CommonAggregateComponents-2#/$defs/DeliveryTermsType"
          }
        }
      ]
    },
    "PaymentMeans": {
      "oneOf": [
        {
          "$ref": "urn:oasis:names:specification:ubl:schema:json:CommonAggregateComponents-2#/$defs/PaymentMeansType"
        },
        {
          "type": "array",
          "items": {
            "$ref": "urn:oasis:names:specification:ubl:schema:json:CommonAggregateComponents-2#/$defs/PaymentMeansType"
          }
        }
      ]
    },
    "PaymentTerms": {
      "oneOf": [
        {
          "$ref": "urn:oasis:names:specification:ubl:schema:json:CommonAggregateComponents-2#/$defs/PaymentTermsType"
        },
        {
          "type": "array",
          "items": {
            "$ref": "urn:oasis:names:specification:ubl:schema:json:CommonAggregateComponents-2#/$defs/PaymentTermsType"
          }
        }
      ]
    },
    "AllowanceCharge": {
      "oneOf": [
        {
          "$ref": "urn:oasis:names:specification:ubl:schema:json:CommonAggregateComponents-2#/$defs/AllowanceChargeType"
        },
        {
          "type": "array",
          "items": {
            "$ref": "urn:oasis:names:specification:ubl:schema:json:CommonAggregateComponents-2#/$defs/AllowanceChargeType"
          }
        }
      ]
    },
    "TaxExchangeRate": {
      "$ref": "urn:oasis:names:specification:ubl:schema:json:CommonAggregateComponents-2#/$defs/ExchangeRateType"
    },
    "PricingExchangeRate": {
      "$ref": "urn:oasis:names:specification:ubl:schema:json:CommonAggregateComponents-2#/$defs/ExchangeRateType"
    },
    "PaymentExchangeRate": {
      "$ref": "urn:oasis:names:specification:ubl:schema:json:CommonAggregateComponents-2#/$defs/ExchangeRateType"
    },
    "PaymentAlternativeExchangeRate": {
      "$ref": "urn:oasis:names:specification:ubl:schema:json:CommonAggregateComponents-2#/$defs/ExchangeRateType"
    },
    "TaxTotal": {
      "oneOf": [
        {
          "$ref": "urn:oasis:names:specification:ubl:schema:json:CommonAggregateComponents-2#/$defs/TaxTotalType"
        },
        {
          "type": "array",
          "items": {
            "$ref": "urn:oasis:names:specification:ubl:schema:json:CommonAggregateComponents-2#/$defs/TaxTotalType"
          }
        }
      ]
    },
    "WithholdingTaxTotal": {
      "oneOf": [
        {
          "$ref": "urn:oasis:names:specification:ubl:schema:json:CommonAggregateComponents-2#/$defs/TaxTotalType"
        },
        {
          "type": "array",
          "items": {
            "$ref": "urn:oasis:names:specification:ubl:schema:json:CommonAggregateComponents-2#/$defs/TaxTotalType"
          }
        }
      ]
    },
    "LegalMonetaryTotal": {
      "$ref": "urn:oasis:names:specification:ubl:schema:json:CommonAggregateComponents-2#/$defs/MonetaryTotalType"
    },
    "CollectionCreditNoteLine": {
      "oneOf": [
        {
          "$ref": "urn:oasis:names:specification:ubl:schema:json:CommonAggregateComponents-2#/$defs/CreditNoteLineType"
        },
        {
          "type": "array",
          "items": {
            "$ref": "urn:oasis:names:specification:ubl:schema:json:CommonAggregateComponents-2#/$defs/CreditNoteLineType"
          }
        }
      ]
    },
    "CreditNoteLine": {
      "oneOf": [
        {
          "$ref": "urn:oasis:names:specification:ubl:schema:json:CommonAggregateComponents-2#/$defs/CreditNoteLineType"
        },
        {
          "type": "array",
          "items": {
            "$ref": "urn:oasis:names:specification:ubl:schema:json:CommonAggregateComponents-2#/$defs/CreditNoteLineType"
          },
          "minItems": 1
        }
      ]
    }
  },
  "required": [
    "UBLEntity",
    "ID",
    "IssueDate",
    "AccountingCustomerParty",
    "AccountingSupplierParty",
    "LegalMonetaryTotal",
    "CreditNoteLine"
  ],
  "additionalProperties": false,
  "minProperties": 1,
  "title": "Self Billed Credit Note. Details"
}
