{
  "UBLEntity": "urn:oasis:names:specification:ubl:schema:json:SelfBilledCreditNote-2",
  "UBLVersionID": "2.1",
  "ID": "TOSL108",
  "IssueDate": "2009-12-15",
  "Note": {
    "value": "Ordered in our booth at the convention.",
    "languageID": "en"
  },
  "DocumentCurrencyCode": {
    "value": "EUR",
    "listID": "6:ISO 4217 Alpha"
  },
  "AccountingCost": "Project cost code 123",
  "InvoicePeriod": {
    "StartDate": "2009-11-01",
    "EndDate": "2009-11-30"
  },
  "OrderReference": {
    "ID": "123"
  },
  "ContractDocumentReference": {
    "ID": "Contract321",
    "DocumentType": "Framework agreement"
  },
  "AdditionalDocumentReference": [
    {
      "ID": "Doc1",
      "DocumentType": "Timesheet",
      "Attachment": {
        "ExternalReference": {
          "URI": "http://www.suppliersite.eu/sheet001.html"
        }
      }
    },
    {
      "ID": "Doc2",
      "DocumentType": "Drawing",
      "Attachment": {
        "EmbeddedDocumentBinaryObject": {
          "value": "UjBsR09EbGhjZ0dTQUxNQUFBUUNBRU1tQ1p0dU1GUXhEUzhi",
          "mimeCode": "application/pdf"
        }
      }
    }
  ],
  "AccountingCustomerParty": {
    "Party": {
      "PartyIdentification": {
        "ID": {
          "value": "345KS5324",
          "schemeID": "ZZZ"
        }
      },
      "PartyName": {
        "Name": "Buyercompany ltd"
      },
      "PostalAddress": {
        "ID": {
          "value": "1238764941386",
          "schemeID": "9:GLN"
        },
        "Postbox": "123",
        "StreetName": "Anystreet",
        "AdditionalStreetName": "Back door",
        "BuildingNumber": "8",
        "Department": "Accounting department",
        "CityName": "Anytown",
        "PostalZone": "101",
        "CountrySubentity": "RegionB",
        "Country": {
          "IdentificationCode": {
            "value": "BE",
            "listID": "6:ISO3166-1"
          }
        }
      },
      "PartyTaxScheme": {
        "CompanyID": {
          "value": "BE54321",
          "schemeID": "ZZZ:BEVAT"
        },
        "TaxScheme": {
          "ID": {
            "value": "VAT",
            "schemeID": "6:UN/ECE 5153"
          }
        }
      },
      "PartyLegalEntity": {
        "RegistrationName": "The buyercompany inc.",
        "CompanyID": {
          "value": "5645342123",
          "schemeID": "ZZZ:ZZZ"
        },
        "RegistrationAddress": {
          "CityName": "Mainplace",
          "CountrySubentity": "RegionB",
          "Country": {
            "IdentificationCode": "BE"
          }
        }
      },
      "Contact": {
        "Telephone": "5121230",
        "Telefax": "5121231",
        "ElectronicMail": "john@buyercompany.eu"
      },
      "Person": {
        "FirstName": "John",
        "FamilyName": "X",
        "MiddleName": "Doe",
        "JobTitle": "Purchasing manager"
      }
    }
  },
  "AccountingSupplierParty": {
    "Party": {
      "PartyIdentification": {
        "ID": {
          "value": "Supp123",
          "schemeID": "ZZZ"
        }
      },
      "PartyName": {
        "Name": "Salescompany ltd."
      },
      "PostalAddress": {
        "ID": {
          "value": "1231412341324",
          "schemeID": "9:GLN"
        },
        "Postbox": "5467",
        "StreetName": "Main street",
        "AdditionalStreetName": "Suite 123",
        "BuildingNumber": "1",
        "Department": "Revenue department",
        "CityName": "Big city",
        "PostalZone": "54321",
        "CountrySubentityCode": "RegionA",
        "Country": {
          "IdentificationCode": {
            "value": "DK",
            "listID": "6:ISO3166-1"
          }
        }
      },
      "PartyTaxScheme": {
        "CompanyID": {
          "value": "DK12345",
          "schemeID": "ZZZ:DKVAT"
        },
        "TaxScheme": {
          "ID": {
            "value": "VAT",
            "schemeID": "6:UN/ECE 5153"
          }
        }
      },
      "PartyLegalEntity": {
        "RegistrationName": "The Sellercompany Incorporated",
        "CompanyID": {
          "value": "5402697509",
          "schemeID": "ZZZ:CVR"
        },
        "RegistrationAddress": {
          "CityName": "Big city",
          "CountrySubentity": "RegionA",
          "Country": {
            "IdentificationCode": "DK"
          }
        }
      },
      "Contact": {
        "Telephone": "4621230",
        "Telefax": "4621231",
        "ElectronicMail": "antonio@salescompany.dk"
      },
      "Person": {
        "FirstName": "Antonio",
        "FamilyName": "M",
        "MiddleName": "Salemacher",
        "JobTitle": "Sales manager"
      }
    }
  },
  "PayeeParty": {
    "PartyIdentification": {
      "ID": {
        "value": "098740918237",
        "schemeID": "9:GLN"
      }
    },
    "PartyName": {
      "Name": "Ebeneser Scrooge Inc."
    },
    "PartyLegalEntity": {
      "CompanyID": {
        "value": "6411982340",
        "schemeID": "ZZZ:UK:CH"
      }
    }
  },
  "AllowanceCharge": [
    {
      "ChargeIndicator": true,
      "AllowanceChargeReason": "Packing cost",
      "Amount": {
        "value": 100,
        "currencyID": "EUR"
      }
    },
    {
      "ChargeIndicator": false,
      "AllowanceChargeReason": "Promotion discount",
      "Amount": {
        "value": 100,
        "currencyID": "EUR"
      }
    }
  ],
  "TaxTotal": {
    "TaxAmount": {
      "value": 292.2,
      "currencyID": "EUR"
    },
    "TaxSubtotal": [
      {
        "TaxableAmount": {
          "value": 1460.5,
          "currencyID": "EUR"
        },
        "TaxAmount": {
          "value": 292.1,
          "currencyID": "EUR"
        },
        "TaxCategory": {
          "ID": {
            "value": "S",
            "schemeID": "6:UN/ECE 5305"
          },
          "Percent": 20,
          "TaxScheme": {
            "ID": {
              "value": "VAT",
              "schemeID": "6:UN/ECE 5153"
            }
          }
        }
      },
      {
        "TaxableAmount": {
          "value": 1,
          "currencyID": "EUR"
        },
        "TaxAmount": {
          "value": 0.1,
          "currencyID": "EUR"
        },
        "TaxCategory": {
          "ID": {
            "value": "AA",
            "schemeID": "6:UN/ECE 5305"
          },
          "Percent": 10,
          "TaxScheme": {
            "ID": {
              "value": "VAT",
              "schemeID": "6:UN/ECE 5153"
            }
          }
        }
      },
      {
        "TaxableAmount": {
          "value": -25,
          "currencyID": "EUR"
        },
        "TaxAmount": {
          "value": 0,
          "currencyID": "EUR"
        },
        "TaxCategory": {
          "ID": {
            "value": "E",
            "schemeID": "6:UN/ECE 5305"
          },
          "Percent": 0,
          "TaxExemptionReasonCode": {
            "value": "AAM",
            "listID": "ZZZ:CWA 15577"
          },
          "TaxExemptionReason": "Exempt New Means of Transport",
          "TaxScheme": {
            "ID": {
              "value": "VAT",
              "schemeID": "6:UN/ECE 5153"
            }
          }
        }
      }
    ]
  },
  "LegalMonetaryTotal": {
    "LineExtensionAmount": {
      "value": 1436.5,
      "currencyID": "EUR"
    },
    "TaxExclusiveAmount": {
      "value": 1436.5,
      "currencyID": "EUR"
    },
    "TaxInclusiveAmount": {
      "value": 1729,
      "currencyID": "EUR"
    },
    "AllowanceTotalAmount": {
      "value": 100,
      "currencyID": "EUR"
    },
    "ChargeTotalAmount": {
      "value": 100,
      "currencyID": "EUR"
    },
    "PrepaidAmount": {
      "value": 1000,
      "currencyID": "EUR"
    },
    "PayableRoundingAmount": {
      "value": 0.3,
      "currencyID": "EUR"
    },
    "PayableAmount": {
      "value": 729,
      "currencyID": "EUR"
    }
  },
  "CreditNoteLine": [
    {
      "ID": "1",
      "Note": "Scratch on box",
      "CreditedQuantity": {
        "value": 1,
        "unitCode": "C62"
      },
      "LineExtensionAmount": {
        "value": 1273,
        "currencyID": "EUR"
      },
      "AccountingCost": "BookingCode001",
      "TaxTotal": {
        "TaxAmount": {
          "value": 254.6,
          "currencyID": "EUR"
        }
      },
      "Item": {
        "Description": {
          "value": "Processor: Intel Core 2 Duo SU9400 LV (1.4GHz). RAM:\n\t\t\t\t3MB. Screen 1440x900",
          "languageID": "EN"
        },
        "Name": "Labtop computer",
        "SellersItemIdentification": {
          "ID": "JB007"
        },
        "StandardItemIdentification": {
          "ID": {
            "value": "1234567890124",
            "schemeID": "9:GTIN"
          }
        },
        "CommodityClassification": [
          {
            "ItemClassificationCode": {
              "value": "12344321",
              "listID": "113:UNSPSC"
            }
          },
          {
            "ItemClassificationCode": {
              "value": "65434568",
              "listID": "2:CPV"
            }
          }
        ],
        "ClassifiedTaxCategory": {
          "ID": {
            "value": "S",
            "schemeID": "6:UN/ECE 5305"
          },
          "Percent": 20,
          "TaxScheme": {
            "ID": {
              "value": "VAT",
              "schemeID": "6:UN/ECE 5153"
            }
          }
        },
        "AdditionalItemProperty": {
          "Name": "Color",
          "Value": "black"
        }
      },
      "Price": {
        "PriceAmount": {
          "value": 1273,
          "currencyID": "EUR"
        },
        "BaseQuantity": {
          "value": 1,
          "unitCode": "C62"
        },
        "AllowanceCharge": {
          "ChargeIndicator": false,
          "AllowanceChargeReason": "Contract",
          "MultiplierFactorNumeric": 0.15,
          "Amount": {
            "value": 225,
            "currencyID": "EUR"
          },
          "BaseAmount": {
            "value": 1500,
            "currencyID": "EUR"
          }
        }
      }
    },
    {
      "ID": "2",